name,description,location,address,phone,email,website,image_url,verified,price_range,status,badge,owner_id,slug,lat,lng,source,source_id,owner_verified,owner_verification_requested_at,owner_verification_method,owner_verification_notes,primary_category_slug,category_raw,hours,last_activity_at,primary_subcategory_label,primary_subcategory_slug,is_system,is_hidden,owner_verified_at,rejection_reason,approved_at,approved_by,is_chain,normalized_name,rejected_at,rejected_by
Table Mountain Aerial Cableway,"The Table Mountain Aerial Cableway is a popular cable car attraction in Cape Town that transports visitors from the lower slopes of Table Mountain to its flat-topped summit in about five minutes. Featuring rotating cabins that provide 360-degree views, the ride offers spectacular panoramas of the city, coastline, and surrounding mountains. It’s one of South Africa’s most iconic and visited experiences.",table mountain (nature reserve),"5821 Tafelberg Rd, Cape town, 8001",214240015,info@tablemountain.net,https://www.tablemountain.net/talk-to-us,,false,$$,active,,,,,,newBusinessData.xlsx,table-mountain-aerial-cableway,false,,,,outdoors-adventure,Outdoors and adventure,"{""raw"": ""First up 08:00 Last up 19:00 Last down 20:00"", ""friendly"": null}",,Hiking,hiking,false,false,,,,,false,,,
Zeitz MOCAA,"The Zeitz Museum of Contemporary Art Africa (Zeitz MOCAA) is a world-class museum dedicated to contemporary art from Africa and its diaspora. Located at the V&A Waterfront in a strikingly redesigned historic grain silo, the museum features cutting-edge exhibitions across multiple floors, showcasing painting, sculpture, photography, and multimedia works. It is the largest museum of contemporary African art in the world and a major cultural landmark in Cape Town.",de waterkant,"S Arm rd, Victoria & Alfred waterfront, cape town, 8001",873504777,info@zeitzmochaa.museum,https://zeitzmocaa.museum/?v=959848ca10cc,,false,$$,active,,,,,,newBusinessData.xlsx,zeitz-mocaa,false,,,,arts-culture,Arts and culture,"{""raw"": ""Monday-Sunday 10am-6pm"", ""friendly"": null}",,Museums,museums,false,false,,,,,false,,,
Kirstenbosch National Botanical Garden,"The Kirstenbosch National Botanical Garden is a world-renowned botanical garden nestled on the eastern slopes of Table Mountain in Cape Town. Celebrated for its stunning landscapes and diverse collection of indigenous South African plants, it features scenic walking trails, the famous Boomslang canopy walkway, and seasonal open-air concerts. Kirstenbosch is considered one of the most beautiful botanical gardens in the world and a must-visit natural attraction in the city.",newlands,"Rhodes dr, newlands, cape town",021 799 8783 / 021 799 8773,KirstenboschInfo@sanbi.org.za,https://www.sanbi.org/gardens/kirstenbosch/,,false,$$,active,,,,,,newBusinessData.xlsx,kirstenbosch-national-botanical-garden,false,,,,outdoors-adventure,Outdoors and adventure,"{""raw"": ""The garden is open every day from 08h00 to 19h00 during summer (Sep-Mar), 08h00 to 18h00 during winter (Apr-Aug) The Conservatory is open every day from 09h00 to 17h00. The Curator’s Office is open Monday to Friday only, from 07h30-16h20, except on public holidays."", ""friendly"": null}",,Hiking,hiking,false,false,,,,,false,,,
Robben Island Museum Tours,"The Robben Island Museum is a historic site and museum located on Robben Island, just off the coast of Cape Town. Once used as a prison during apartheid, it is most famous for holding Nelson Mandela for 18 years. Today, it is a UNESCO World Heritage Site where visitors can tour the former prison, see Mandela’s cell, and learn about South Africa’s journey to freedom through guided tours often led by former political prisoners.",de waterkant,"V&A Waterfront, cape town",214134200,infow@robben-island.org.za,https://www.robben-island.org.za/,,false,$$,active,,,,,,newBusinessData.xlsx,robben-island-museum-tours,false,,,,arts-culture,Arts and culture,"{""raw"": ""Monday to Sunday - 08:00 to 17:00"", ""friendly"": null}",,Museums,museums,false,false,,,,,false,,,
Cape Point Nature Reserve,"The Cape Point Nature Reserve is a dramatic coastal conservation area located at the southern tip of the Cape Peninsula within the Table Mountain National Park. Known for its towering sea cliffs, rugged landscapes, and diverse wildlife, it offers scenic hiking trails, pristine beaches, and panoramic ocean views. Visitors can explore the historic lighthouse and experience the iconic meeting point of the Atlantic and Indian Oceans near the Cape of Good Hope.",simon's town,"Cape Peninsula, Simon's Town, 7995, South Africa",217809010,info@capepoint.co.za,https://capepoint.co.za/,,false,$$,active,,,,,,newBusinessData.xlsx,cape-point-nature-reserve,false,,,,outdoors-adventure,Outdoors and adventure,"{""raw"": ""April-Sptember 7am-5pm October-March 6am-6pm"", ""friendly"": null}",,Hiking,hiking,false,false,,,,,false,,,
Boulders Beach Penguin Colony,"The Boulders Beach Penguin Colony is a protected beach area near Simon’s Town, just outside Cape Town, famous for its colony of endangered African penguins. Part of Table Mountain National Park, the site features wooden boardwalks that allow visitors to observe the penguins up close in their natural habitat, surrounded by large granite boulders and clear turquoise waters. It is one of the few places in the world where you can see penguins living on a beach.",simon's town,simon's town cape town,(0)21 786 2329,reservations@sanparks.org,https://www.sanparks.org/parks/table-mountain/what-to-do/attractions/boulders-penguin-colony,,false,$$,active,,,,,,newBusinessData.xlsx,boulders-beach-penguin-colony,false,,,,outdoors-adventure,Outdoors and adventure,,,Sports & Recreation,sports-recreation,false,false,,,,,false,,,
Camps Bay Beach,"The Camps Bay Beach is one of Cape Town’s most popular and scenic beaches, known for its white sand, clear Atlantic waters, and stunning backdrop of the Twelve Apostles mountain range. Lined with palm trees, cafés, and stylish restaurants, it’s a favourite spot for sunbathing, sunset views, and vibrant beachfront dining.",camps bay,"victoria road, camps bay",214394332,,https://www.capetown.gov.za/Family%20and%20home/see-all-city-facilities/our-recreational-facilities/Beaches/Camps%20Bay%20Beach,,false,$$,active,,,,,,newBusinessData.xlsx,camps-bay-beach,false,,,,outdoors-adventure,Outdoors and adventure,,,Water Sports,water-sports,false,false,,,,,false,,,
Sea Point Promenade,"The Sea Point Promenade is a vibrant, scenic oceanfront walkway stretching along Cape Town’s Atlantic coastline. Popular with walkers, joggers, and cyclists, it offers panoramic sea views, landscaped gardens, public art, and outdoor fitness areas. The promenade is a favourite spot for both locals and tourists to enjoy sunrise or sunset strolls and the refreshing ocean breeze.",sea point,,,,,,false,$$,active,,,,,,newBusinessData.xlsx,sea-point-promenade,false,,,,outdoors-adventure,Outdoors and adventure,,,Cycling,cycling,false,false,,,,,false,,,
Chapman’s Peak Drive,"Chapman's Peak Drive is a world-famous scenic coastal road that winds along the cliffs between Hout Bay and Noordhoek. Renowned for its breathtaking ocean vistas, dramatic cliffs, and winding curves, the drive offers multiple viewpoints for photography, picnics, and sunset watching. It’s considered one of the most spectacular coastal drives in the world.",chapman's peak,,,,,,false,$$,active,,,,,,newBusinessData.xlsx,chapman-s-peak-drive,false,,,,outdoors-adventure,Outdoors and adventure,,,Hiking,hiking,false,false,,,,,false,,,
Baxter Theatre Centre,"The Baxter Theatre Centre is a renowned cultural venue in Cape Town, known for presenting contemporary theatre, music, and dance performances. Situated in the suburb of Rondebosch, it combines a main theatre and studio spaces, supporting both professional productions and emerging local artists, making it a vibrant hub for performing arts in the city.",rondebosch,"Main road, rondebosch, cape town",216857880,,https://baxter.uct.ac.za/,,false,$$,active,,,,,,newBusinessData.xlsx,baxter-theatre-centre,false,,,,arts-culture,Arts and culture,,,Theatres,theaters,false,false,,,,,false,,,
Canal Walk Shopping Centre,"The Canal Walk Shopping Centre is one of the largest and most popular shopping malls in Cape Town. Located in the suburb of Century City, it features a wide range of local and international retail stores, a large food court, entertainment options, and ample parking, making it a prime destination for shopping, dining, and leisure activities.",century city,"490 century blvd, century city, cape town",(021) 529 9699,,https://canalwalk.co.za/,,false,$$,active,,,,,,newBusinessData.xlsx,canal-walk-shopping-centre,false,,,,shopping-lifestyle,Shopping &lifestyle,"{""raw"": ""Monday-Sunday 9am-9pm"", ""friendly"": null}",,Fashion & Clothing,fashion,false,false,,,,,false,,,
Old Biscuit Mill,"The Old Biscuit Mill is a vibrant market and creative hub located in Woodstock, Cape Town. Housed in a renovated industrial building, it is famous for its weekend food market, artisanal products, local crafts, and design shops. The space also hosts events, exhibitions, and pop-up markets, making it a lively destination for food lovers, artists, and culture enthusiasts.",woodstock,"The Old Biscuit Mill 373-375 Albert Road, Woodstock, Cape Town.",214478194,info@theoldbiscuitmill.co.za,https://theoldbiscuitmill.co.za/,,false,$$,active,,,,,,newBusinessData.xlsx,old-biscuit-mill,false,,,,shopping-lifestyle,Shopping &lifestyle,"{""raw"": ""Monday – Friday 10:00 – 16:00 Saturday – 09:00 – 16:00 Sunday - 10:00 - 14:00"", ""friendly"": null}",,Fashion & Clothing,fashion,false,false,,,,,false,,,
Neighbourgoods Market (Woodstock),"The Neighbourgoods Market is a popular weekend market held at the Old Biscuit Mill in Woodstock, Cape Town. It features a wide array of fresh produce, gourmet foods, artisanal products, and craft beverages. Known for its lively atmosphere, live music, and vibrant community vibe, it’s a favourite destination for locals and tourists seeking quality food and unique shopping experiences.",woodstock,"373-375 Albert Road, woodstock, Cape Town",795804676,info@neighbourgoodsmarket.co.za,https://www.neighbourgoodsmarket.co.za/,,false,$$,active,,,,,,newBusinessData.xlsx,neighbourgoods-market-woodstock,false,,,,shopping-lifestyle,Shopping &lifestyle,"{""raw"": ""Saturday 9am -7pm Sunday 10am-5pm"", ""friendly"": null}",,Fashion & Clothing,fashion,false,false,,,,,false,,,
Oranjezicht City Farm Market,"The Oranjezicht City Farmers' Market is a weekly market located at Granger Bay near the base of Table Mountain in Cape Town. It focuses on fresh, locally sourced produce, artisanal foods, and sustainable products. The market is celebrated for its community atmosphere, healthy eating options, and support of local farmers and small businesses.",de waterkant,"Cnr Granger Bay Boulevard and Dock Rd, V&A Waterfront, Cape town",836283426,market@ozcf.co.za,https://ozcf.co.za/ozcfmarket/,,false,$$,active,,,,,,newBusinessData.xlsx,oranjezicht-city-farm-market,false,,,,shopping-lifestyle,Shopping &lifestyle,"{""raw"": ""Saturday 08:00 - 14:30 Sunday 08:30 - 14:30 Wednesday Night Market 16:00 - 21:30"", ""friendly"": null}",,Fashion & Clothing,fashion,false,false,,,,,false,,,
Bay Harbour Market (Hout Bay),"The Bay Harbour Market is a bustling weekend market located in Hout Bay, Cape Town. It offers a mix of artisanal foods, crafts, fashion, and live music, creating a vibrant and lively atmosphere. The market is popular for its diverse culinary offerings, local art, and community vibe, making it a favourite destination for both locals and visitors.",houtbay,"31 Harbour Road, Houtbay, cape town",843705715,info@bayharbour.co.za,https://www.bayharbour.co.za/,,false,$$,active,,,,,,newBusinessData.xlsx,bay-harbour-market-hout-bay,false,,,,shopping-lifestyle,Shopping &lifestyle,"{""raw"": ""Friday: 9:30 am – 9pm Wednesday, Thursday, Saturday & Sunday: 9.30am – 5pm"", ""friendly"": null}",,Fashion & Clothing,fashion,false,false,,,,,false,,,
Woodstock Exchange,"The The Woodstock Exchange is a creative hub in the Woodstock district of Cape Town. Housed in a renovated industrial building, it features boutique shops, design studios, artisanal retailers, cafés, and event spaces. The Woodstock Exchange is known for fostering local creativity and innovation, making it a vibrant destination for shopping, dining, and cultural experiences.",woodstock,"66 Albert Road, woodstock, cape town",,info@woodstockexchange.co.za,https://www.woodstockexchange.co.za/about,,false,$$,active,,,,,,newBusinessData.xlsx,woodstock-exchange,false,,,,shopping-lifestyle,Shopping &lifestyle,"{""raw"": ""Monday - Sunday 8am-5pm"", ""friendly"": null}",,Fashion & Clothing,fashion,false,false,,,,,false,,,
Woodstock Foundry,"The Woodstock Foundry is a contemporary creative and retail space in Woodstock, Cape Town. Set in a converted industrial building, it houses art studios, design shops, artisanal stores, and cafés. The venue is a hub for local artists and makers, offering visitors a unique blend of shopping, dining, and cultural experiences in a vibrant, urban setting.",woodstock,"150-170 Albert Road, woodstock, cape town",214220466,woodstockfoundry@capeld.co.za,http://www.woodstockfoundry.co.za/,,false,$$,active,,,,,,newBusinessData.xlsx,woodstock-foundry,false,,,,shopping-lifestyle,Shopping &lifestyle,"{""raw"": ""something wrong with website"", ""friendly"": null}",,Fashion & Clothing,fashion,false,false,,,,,false,,,
Greenmarket Square Market,"The Greenmarket Square Market is a historic outdoor market located in the heart of Cape Town’s city centre. Famous for its vibrant stalls selling crafts, souvenirs, jewelry, and artwork, it has been a hub for local traders and artisans for centuries. The market offers a lively atmosphere and is a popular spot for tourists looking to experience Cape Town’s culture and pick up unique, handcrafted items.",Cape Town,,,,,,false,$$,active,,,,,,newBusinessData.xlsx,greenmarket-square-market,false,,,,shopping-lifestyle,Shopping &lifestyle,,,Fashion & Clothing,fashion,false,false,,,,,false,,,
Merchants on Long,"The Merchants on Long is a stylish retail and dining destination located on Long Street in Cape Town’s city centre. Housed in a historic building, it features boutique shops, artisanal food outlets, and cafés, blending contemporary design with heritage architecture. It’s popular for its vibrant atmosphere, curated shopping, and social spaces.",cape town city centre,"34 long street, cape town",214222828,info@merchantsonlong.com,https://www.merchantsonlong.co.za/,,false,$$,active,,,,,,newBusinessData.xlsx,merchants-on-long,false,,,,shopping-lifestyle,Shopping &lifestyle,"{""raw"": ""Moday-Friday 9am-6pm Saturday 9am-4pm Sunday closed"", ""friendly"": null}",,Fashion & Clothing,fashion,false,false,,,,,false,,,
AKJP Concept Store,"The AKJP Concept Store is a contemporary retail space in Cape Town showcasing a curated selection of fashion, lifestyle, and design products. Known for supporting local designers and emerging brands, the store blends innovative design with unique, high-quality merchandise, offering visitors a stylish and modern shopping experience.",gardens,"73 Kloof street, gardens, cape town",794909492,info@akjpstudio.com,https://www.akjpstudio.com/pages/info,,false,$$,active,,,,,,newBusinessData.xlsx,akjp-concept-store,false,,,,shopping-lifestyle,Shopping &lifestyle,,,Fashion & Clothing,fashion,false,false,,,,,false,,,
Pichulik Jewellery Atelier,"The Pichulik Jewellery Atelier is a boutique studio and flagship store in Cape Town, known for its distinctive, handcrafted jewelry. Celebrated for bold, sculptural designs inspired by African heritage and contemporary aesthetics, Pichulik creates pieces that blend artistry, cultural storytelling, and modern craftsmanship. The atelier offers visitors a chance to explore collections, custom pieces, and the brand’s unique creative process.",cape town city centre,"8 Watson Street (just off of Bree Street), cape town",721049544,info@pichulik.com,,,false,$$,active,,,,,,newBusinessData.xlsx,pichulik-jewellery-atelier,false,,,,shopping-lifestyle,Shopping &lifestyle,"{""raw"": ""Monday - Thursday: 9am - 4pm Friday: 9am - 3pm Saturday/ Sunday/ Public Holidays: Closed"", ""friendly"": null}",,Fashion & Clothing,fashion,false,false,,,,,false,,,
Truth Coffee Roasting,"The Truth Coffee Roasting is a renowned specialty coffee shop and roastery located in Cape Town’s city centre. Famous for its artisanal coffee, steampunk-inspired interior, and commitment to quality roasting, it offers a unique café experience. Truth Coffee is celebrated both locally and internationally for its innovative brewing techniques, carefully sourced beans, and vibrant café atmosphere.",cape town city centre,"36 Buitekant street, cape town",212017000,needbeans@truthcoffee.com,https://za.truth.coffee/,,false,$$,active,,,,,,newBusinessData.xlsx,truth-coffee-roasting,false,,,,food-drink,food and drink,"{""raw"": ""Mon: 06:30  – 18:00 Tues-Fri: 06:30 – 22:00 Sat: 08:00  – 22:00 Sun: 08:00 – 16:00"", ""friendly"": null}",,Cafes & Coffee,cafes,false,false,,,,,false,,,
Ground Art Caffe,"The Ground Art Caffe is a trendy café in Cape Town known for its specialty coffee, artisanal beverages, and relaxed, creative atmosphere. It combines high-quality coffee brewing with a focus on artful presentation and a welcoming space, making it a popular spot for locals and visitors to enjoy coffee, light meals, and a casual social environment.",bo kaap,160 Strand street cape town,214181331,info@groundartcaffe.co.za,https://www.groundartcaffe.co.za/,,false,$$,active,,,,,,newBusinessData.xlsx,ground-art-caffe,false,,,,food-drink,food and drink,,,Cafes & Coffee,cafes,false,false,,,,,false,,,
The Ladder on Bree,"The The Ladder on Bree is a contemporary café and lifestyle spot located on Bree Street in Cape Town. Known for its specialty coffee, artisanal food offerings, and stylish, inviting interior, it serves as a social hub for locals and visitors. The venue emphasizes quality, creativity, and a relaxed atmosphere, making it a popular destination for dining and casual gatherings.",cape town city centre,"136 Bree St, Cape Town City Centre, Cape Town, 8001",824511572,theladderon136@gmail.com,https://www.theladderon136.com/,,false,$$,active,,,,,,newBusinessData.xlsx,the-ladder-on-bree,false,,,,food-drink,food and drink,"{""raw"": ""Monday-Friday 07:00-16:00 Saturday 08:00-14:00"", ""friendly"": null}",,Cafes & Coffee,cafes,false,false,,,,,false,,,
Kleinsky’s,"The Kleinsky's is a well-known bakery and café in Cape Town, famed for its freshly baked breads, pastries, and artisanal coffee. Praised for its quality ingredients and traditional baking techniques, Kleinsky's offers a cozy and inviting atmosphere, making it a favourite destination for breakfast, brunch, or a casual coffee stop.",sea point,"92 Regent street, Sea point, Cape Town",214332871,info@kleinskys.co.za,https://www.kleinskys.co.za/?srsltid=AfmBOooXrZwS_Zkary0i1cONr-DJeOj46lSr9BVWkSj8gYDl9w8wPmoO,,false,$$,active,,,,,,newBusinessData.xlsx,kleinsky-s,false,,,,food-drink,food and drink,"{""raw"": ""MON - SUN 8:00AM - 5:00PM"", ""friendly"": null}",,Cafes & Coffee,cafes,false,false,,,,,false,,,
Starlings Café,"The Starlings Café is a charming café in Cape Town known for its specialty coffee, fresh pastries, and relaxed, welcoming atmosphere. It emphasizes quality ingredients and artisanal preparation, making it a popular spot for breakfast, brunch, or casual coffee breaks among locals and visitors alike.",Cape Town,,720510491,,https://www.starlings.co.za/,,false,$$,active,,,,,,newBusinessData.xlsx,starlings-caf,false,,,,food-drink,food and drink,,,Cafes & Coffee,cafes,false,false,,,,,false,,,
Bootlegger Coffee (Sea Point point mall),"The Bootlegger Coffee Company is a popular café and coffee roastery in Cape Town, renowned for its specialty coffee, casual atmosphere, and high-quality espresso and filter coffee offerings. With multiple locations across the city, Bootlegger combines artisanal coffee with freshly prepared meals and pastries, making it a favourite spot for both locals and tourists seeking a relaxed café experience.",sea point,"The Point Mall, 76 Regent Road, Sea Point, Cape Town",214332000,pointmall@bootlegger.co.za,https://ourcafes.bootlegger.coffee/FoodDrink-CapeTown-BootleggerThePointMall,,false,$$,active,,,,,,newBusinessData.xlsx,bootlegger-coffee-sea-point-point-mall,false,,,,food-drink,food and drink,"{""raw"": ""Monday-Friday 6;30-5pm Saturday and Sunday 7am-3pm"", ""friendly"": null}",,Cafes & Coffee,cafes,false,false,,,,,false,,,
Yours Truly (Kloof Street),"The Yours Truly Kloof Street is a stylish café and restaurant in Cape Town’s Kloof Street district. Known for its artisanal coffee, gourmet breakfast and brunch offerings, and elegant yet relaxed ambiance, it provides a popular spot for both locals and visitors to enjoy high-quality food and beverages in a welcoming, contemporary setting.",gardens,"73 Kloof St, Gardens, Cape Town,",214262505,info@allyoursco.com,https://www.allyoursco.com/yours-truly,,false,$$,active,,,,,,newBusinessData.xlsx,yours-truly-kloof-street,false,,,,food-drink,food and drink,"{""raw"": ""Monday - Sunday 07:00-00:00"", ""friendly"": null}",,Cafes & Coffee,cafes,false,false,,,,,false,,,
La Colombe (waterfront),"The La Colombe is a world-renowned fine-dining restaurant located in Cape Town. Celebrated for its innovative contemporary cuisine, exceptional service, and elegant setting, La Colombe consistently ranks among South Africa’s top restaurants. It offers creative tasting menus that blend global flavors with local ingredients, making it a destination for gourmet food enthusiasts.",de waterkant,"V&A Waterfront, cape town",218796328,,https://www.lacolombe.restaurant/,,false,$$,active,,,,,,newBusinessData.xlsx,la-colombe-waterfront,false,,,,food-drink,food and drink,,,Restaurants,restaurants,false,false,,,,,false,,,
The Pot Luck Club,"The The Pot Luck Club is a modern, fine-dining restaurant located in the Old Biscuit Mill in Woodstock, Cape Town. Known for its innovative small-plate sharing concept, it offers bold, globally inspired flavors and artful presentations. The Pot Luck Club is celebrated for its vibrant atmosphere, panoramic views of the city, and inventive culinary experiences.",woodstock,"Silo Top Floor, the old biscuit mill, 373-375 Albert Road, woodstock",214470804,hello@potluckclub.co.za,https://thepotluckclub.co.za/home/,,false,$$,active,,,,,,newBusinessData.xlsx,the-pot-luck-club,false,,,,food-drink,food and drink,,,Restaurants,restaurants,false,false,,,,,false,,,
Belly of the Beast,"The Belly of the Beast is a popular butcher shop and restaurant in Cape Town known for its high-quality, locally sourced meats and house-made charcuterie. It emphasizes artisanal butchery, sustainability, and bold flavors, offering both retail cuts and cooked dishes. The venue has gained a reputation for creative meat-focused dining and exceptional quality in a casual yet stylish setting.",district six,110 Harrington street cape town,762205458,eat@bellyofthebeast.co.za,https://bellyofthebeast.co.za/?srsltid=AfmBOoo4il5KvXPsCXdqlKJ2zmI3-Ah_UpNZRKvOEprmXW6wArzBHH4x,,false,$$,active,,,,,,newBusinessData.xlsx,belly-of-the-beast,false,,,,food-drink,food and drink,"{""raw"": ""Lunch: 12:30pm Tuesday to Saturday Dinner: 18:45 Monday to Saturday"", ""friendly"": null}",,Restaurants,restaurants,false,false,,,,,false,,,
Utopia Cape Town,"The Utopia Cape Town is a rooftop restaurant and lounge located in Cape Town’s city centre. Known for its modern design, panoramic views of Table Mountain and the city, and vibrant atmosphere, Utopia offers a mix of contemporary cuisine, cocktails, and entertainment. It’s a popular spot for dining, socializing, and enjoying sunsets in a stylish urban setting.",de waterkant,"Floor 15, 40 Chiappini street, cape town",214183065,info@utopiacapetown.co.za,https://www.utopiacapetown.co.za/,,false,$$,active,,,,,,newBusinessData.xlsx,utopia-cape-town,false,,,,food-drink,food and drink,"{""raw"": ""Monday-Saturday 6:30pm-23:00 Sunday 6:30pm-10:30"", ""friendly"": null}",,Restaurants,restaurants,false,false,,,,,false,,,
Black Sheep Restaurant,"The Black Sheep Restaurant is a contemporary eatery located in the vibrant Gardens district of Cape Town. Known for its innovative, seasonal menu, relaxed yet stylish atmosphere, and focus on locally sourced ingredients, Black Sheep offers a creative dining experience that combines modern cuisine with a casual, welcoming setting.",gardens,104 Kloof street cape town,(021) 426 2661,info@blacksheeprestaurant.co.za,https://blacksheeprestaurant.co.za/,,false,$$,active,,,,,,newBusinessData.xlsx,black-sheep-restaurant,false,,,,food-drink,food and drink,"{""raw"": ""Monday from 17:00 till late. Tuesday to Saturday from 12:00 till late Sundays Closed"", ""friendly"": null}",,Restaurants,restaurants,false,false,,,,,false,,,
Chef’s Warehouse (Bree Street),"The Chefs Warehouse Bree Street is a contemporary fine-dining restaurant in Cape Town’s Bree Street district. Famous for its small-plate tasting menus, innovative dishes, and focus on seasonal, high-quality ingredients, it offers a modern, interactive dining experience. The restaurant is celebrated for bold flavors, creative presentation, and an intimate, vibrant atmosphere.",cape town city centre,"91 bree street, cape town",217730440,91breestreet@chefswarehouse.co.za,https://www.chefswarehouse.co.za/,,false,$$,active,,,,,,newBusinessData.xlsx,chef-s-warehouse-bree-street,false,,,,food-drink,food and drink,,,Restaurants,restaurants,false,false,,,,,false,,,
