name,description,location,address,phone,email,website,image_url,verified,price_range,status,badge,owner_id,slug,lat,lng,source,source_id,owner_verified,owner_verification_requested_at,owner_verification_method,owner_verification_notes,primary_category_slug,category_raw,hours,last_activity_at,primary_subcategory_label,primary_subcategory_slug,is_system,is_hidden,owner_verified_at,rejection_reason,approved_at,approved_by,is_chain,normalized_name,rejected_at,rejected_by
Grub & Vine (bree street),"The Grub & Vine is a casual dining restaurant in Cape Town known for its relaxed atmosphere, hearty meals, and selection of wines and craft beverages. It focuses on quality, locally inspired dishes and is popular for brunch, lunch, and social gatherings, offering a welcoming spot for both locals and visitors to enjoy food and drinks in a friendly setting.",cape town city centre,103 bree street cape town,212160035,hello@grubandvine.co.za,https://grubandvine.co.za/norval/?gad_source=1&gad_campaignid=21368661004&gbraid=0AAAAAqXfRe46zONV3leAYvH0Ucm1dT61T&gclid=Cj0KCQiA7rDMBhCjARIsAGDBuEBZzTrRz8F_u5TDWjbeCGOe25ULwd1fdGImgbWApiE4Znp0Ps_ReHAaApFCEALw_wcB,,false,$$,active,,,,,,newBusinessData.xlsx,grub-vine-bree-street,false,,,,food-drink,food and drink,"{""raw"": ""Wednesday - Saturday 12:00 - 21:00 Sunday\n12:00 - 17:00"", ""friendly"": null}",,Restaurants,restaurants,false,false,,,,,false,,,
SeaBreeze Fish & Shell,"The Seabreeze Fish & Shell is a popular seafood restaurant in Cape Town, known for its fresh fish, shellfish, and coastal-inspired dishes. Offering a relaxed, casual dining atmosphere, it emphasizes locally sourced ingredients and traditional seafood preparations, making it a favourite spot for both locals and tourists seeking authentic Cape Town seafood experiences.",cape town city centre,211 Bree street cape town,747939349,hello@seabreezecapetown.co.za,https://seabreezecapetown.co.za/,,false,$$,active,,,,,,newBusinessData.xlsx,seabreeze-fish-shell,false,,,,food-drink,food and drink,"{""raw"": ""Monday to Sunday 12pm – 9:00pm"", ""friendly"": null}",,Restaurants,restaurants,false,false,,,,,false,,,
Addis in Cape Ethiopian,"The Addis in Cape Ethiopian Restaurant is an Ethiopian dining spot in Cape Town that offers traditional Ethiopian cuisine in a warm and inviting atmosphere. Known for its authentic flavors, injera-based dishes, and communal dining style, it provides a cultural culinary experience highlighting the rich tastes and traditions of Ethiopia.",cape town CBD,"168 Loop street, Cape town CBD",768460929,celebrate@addisincape.co.za,https://addisincape.co.za/?gad_source=1&gad_campaignid=22588725319&gbraid=0AAAAACmo1CH_cEJaoWIVHGW-lrvDDX53_&gclid=Cj0KCQiA7rDMBhCjARIsAGDBuEBp_lxrXOljcB1d-v_lRyfbkSd9NMiArhsj_kcNUoJh_wyDX9Xhk4caAr8LEALw_wcB#menu-block,,false,$$,active,,,,,,newBusinessData.xlsx,addis-in-cape-ethiopian,false,,,,food-drink,food and drink,"{""raw"": ""Lunch Menu: 12:00 – 15:00 Dinner Menu: 16:00 – 22:30 Closed on Sundays"", ""friendly"": null}",,Restaurants,restaurants,false,false,,,,,false,,,
Ethiopian Madam Taitou,"The Ethiopian Madam Taitou is an Ethiopian restaurant in Cape Town known for its authentic cuisine, vibrant flavors, and traditional dining experience. It specializes in injera-based dishes, stews, and vegetarian options, offering guests a genuine taste of Ethiopian culinary culture in a welcoming, culturally rich atmosphere.",Cape Town,,,,,,false,$$,active,,,,,,newBusinessData.xlsx,ethiopian-madam-taitou,false,,,,food-drink,food and drink,,,Restaurants,restaurants,false,false,,,,,false,,,
Marco’s African Place,"The Marco’s African Place is a Cape Town restaurant celebrated for its authentic African cuisine and warm, inviting atmosphere. Specializing in dishes inspired by various African culinary traditions, it offers hearty meals, traditional flavors, and a vibrant dining experience that reflects the continent’s diverse food culture.",bo kaap,"15 Rose lane, bo Kaap, cape town",214235412,marco@marcosafricanplace.com,https://www.marcosafricanplace.com/,,false,$$,active,,,,,,newBusinessData.xlsx,marco-s-african-place,false,,,,food-drink,food and drink,"{""raw"": ""Monday : 15h00 - 23h00 Tuesday - Saturday : 12h00 - 23h00 Sunday : 14h00 - 23h00 Public Holidays: 15h00 - 23h00 Closed on Christmas Day"", ""friendly"": null}",,Restaurants,restaurants,false,false,,,,,false,,,
Bo-Vine Wine & Grill,"The Bo-Vine Wine & Grill is a contemporary restaurant and wine bar in Cape Town, known for its expertly grilled meats, curated wine selection, and relaxed yet stylish atmosphere. It offers a dining experience that combines high-quality cuisine with an emphasis on pairing dishes with fine South African and international wines, making it a popular spot for food and wine enthusiasts.",camps bay,"Shop 1a, The Promenade, 87 Victoria Rd, Camps Bay, Cape Town,",212035314,bovine@cbkitchens.com,https://www.bovinegrillhouse.com/,,false,$$,active,,,,,,newBusinessData.xlsx,bo-vine-wine-grill,false,,,,food-drink,food and drink,,,Restaurants,restaurants,false,false,,,,,false,,,
